{
  "contract_version": "1.0.0",
  "wiki_module_id": "wm_cf13ed8f17d974591013c574",
  "module_id": "mod_media-sem",
  "title": "媒体策略与SEM投放",
  "stable_decision": "模块「媒体策略与SEM投放」共收录 2 个可复用方法，经跨案例验证和人工审阅。",
  "unified_preconditions": [
    "项目需包含与媒体策略与SEM投放相关的分析材料",
    "分析单元需通过B2分段验证"
  ],
  "lens_catalog": [
    {
      "lens_id": "lens_media-sem-001",
      "name": "搜索关键词分层策略",
      "aliases": [],
      "question": "如何基于搜索意图设计多层次的关键词矩阵，为每层设定差异化的搜索目标和预算权重？",
      "use_conditions": [
        "品牌正在进行或计划开始搜索引擎营销",
        "品类搜索量足够支撑SEM的规模效应"
      ],
      "skip_conditions": [
        "品类搜索量过低导致SEM效率不高"
      ],
      "required_inputs": [
        "品牌产品线信息",
        "品类搜索词数据",
        "消费者搜索行为数据",
        "平台投放工具",
        "竞品SEM策略参考"
      ],
      "analysis_operations": [
        "按搜索意图将关键词分层（品牌词/品类词/场景词/竞品词），定义每层的搜索目标和竞价策略",
        "为每层梳理具体关键词并评估搜索量/竞争度/预估成本",
        "设计各层关键词与落地页的匹配策略",
        "按关键词层级分配预算，预估各层效果和整体ROI"
      ],
      "output_types": [
        "SEM关键词策略",
        "预算分配方案"
      ],
      "failure_modes": [
        "关键词策略基于静态数据——搜索趋势和竞品出价持续变化"
      ],
      "boundaries": [
        "关键词策略基于静态数据——搜索趋势和竞品出价持续变化"
      ],
      "variants": [
        {
          "variant_id": "lens_126021f6112b9c99426453ffb3d2ad43",
          "name": "媒体策略与SEM投放：如何为品牌设计基于使用场景的媒体投放和搜索关键词策略？...",
          "use_conditions": [
            "品牌需要进行该模块相关的策略分析",
            "有可获取的相关数据和消费者洞察"
          ],
          "analysis_operations": [
            "按消费者使用场景分类建立关键词矩阵",
            "为每个场景设计从兴趣激发到购买转化的投流路径",
            "规划分阶段的投放节奏（测试→验证→放量→收割）",
            "建立投放效果的衡量指标体系"
          ],
          "source_module_instance_ids": [
            "mi_126021f6112b9c99426453ff"
          ]
        }
      ],
      "source_module_instance_ids": [
        "mi_25c5e0f5983d4c4acd9d6b0e",
        "mi_4c401b376e2e1538c7277d0a",
        "mi_93fda9164972046a5c0a6a36",
        "mi_a276b79b8168f88e72356168",
        "mi_ba182ad849ad3c77b43873e8",
        "mi_c21350ad8f43bbdd266ef59f",
        "mi_e15d552dceec8be95bf3f911"
      ]
    },
    {
      "lens_id": "lens_media-sem-002",
      "name": "投流分阶段放量策略（测试→放量→沉淀）",
      "aliases": [],
      "question": "如何通过分阶段投流策略（小预算测试→验证通过后放量→搜索场收割沉淀），实现投放效率最大化？",
      "use_conditions": [
        "品牌需要进行分阶段的投放测试和优化放量",
        "有足够的内容素材可供测试"
      ],
      "skip_conditions": [
        "品牌只需一次性的固定预算投放"
      ],
      "required_inputs": [
        "内容素材（达人笔记/KOC笔记等）",
        "投流工具",
        "预算分配计划",
        "人群定向策略"
      ],
      "analysis_operations": [
        "第一阶段（测试）：用小预算验证不同内容的自然表现和人群反馈，筛选潜力素材",
        "第二阶段（放量）：对验证通过的内容加大投放，按涟漪模型从核心人群逐层向外扩展受众",
        "第三阶段（沉淀）：在搜索场和大促场景收割已触达人群，完成转化闭环",
        "全周期动态调整各渠道（信息流/搜索/达人加热）的预算配比"
      ],
      "output_types": [
        "分阶段投流方案"
      ],
      "failure_modes": [
        "涟漪模型放量节奏依赖平台算法——需持续监控和调整"
      ],
      "boundaries": [
        "涟漪模型放量节奏依赖平台算法——需持续监控和调整"
      ],
      "variants": [],
      "source_module_instance_ids": [
        "mi_25c5e0f5983d4c4acd9d6b0e",
        "mi_4c401b376e2e1538c7277d0a",
        "mi_93fda9164972046a5c0a6a36",
        "mi_a276b79b8168f88e72356168",
        "mi_ba182ad849ad3c77b43873e8",
        "mi_c21350ad8f43bbdd266ef59f",
        "mi_e15d552dceec8be95bf3f911"
      ]
    }
  ],
  "recipes": [],
  "page_expression_options": [],
  "source_module_instance_ids": [
    "mi_25c5e0f5983d4c4acd9d6b0e",
    "mi_4c401b376e2e1538c7277d0a",
    "mi_93fda9164972046a5c0a6a36",
    "mi_a276b79b8168f88e72356168",
    "mi_ba182ad849ad3c77b43873e8",
    "mi_c21350ad8f43bbdd266ef59f",
    "mi_e15d552dceec8be95bf3f911",
    "mi_126021f6112b9c99426453ff"
  ],
  "wiki_version": "6.0.0",
  "status": "active",
  "approval": {
    "human_approved": true,
    "approved_at": "2026-07-27T12:18:11.789Z",
    "reviewer_note": "B4审阅：1项变更批准"
  },
  "deletion": {
    "deleted": false,
    "reason": "",
    "replaced_by": null
  },
  "created_from_hash": "dc2884d31031fb9518f89f675d246a0277fb366bdad9667743bf559c5ff87343"
}