{
  "contract_version": "1.0.0",
  "wiki_module_id": "wm_7e839715c2df5051e95bf830",
  "module_id": "mod_campaign-journey",
  "title": "传播战役与消费者旅程",
  "stable_decision": "模块「传播战役与消费者旅程」共收录 4 个可复用方法，经跨案例验证和人工审阅。",
  "unified_preconditions": [
    "项目需包含与传播战役与消费者旅程相关的分析材料",
    "分析单元需通过B2分段验证"
  ],
  "lens_catalog": [
    {
      "lens_id": "lens_campaign-journey-001",
      "name": "平台IP合作匹配与Campaign规划",
      "aliases": [],
      "question": "如何将品牌营销节点与平台IP资源系统匹配，设计从背书到口碑到曝光的多层合作框架？",
      "use_conditions": [
        "品牌需要利用平台的IP资源（如电商节点IP、内容平台主题活动）进行整合营销",
        "已有品牌年度核心主张和传播目标，可以对照规划IP合作"
      ],
      "skip_conditions": [
        "品牌预算或策略不支持IP合作的规模和复杂度"
      ],
      "required_inputs": [
        "品牌年度核心主张与传播目标",
        "平台可用IP资源列表",
        "品牌全年营销节点日历",
        "目标人群画像与触媒偏好"
      ],
      "analysis_operations": [
        "梳理品牌自身营销节点与平台IP资源的匹配点，按优先级排序",
        "设计递进式IP合作框架：背书层（建立信任）→口碑层（扩大影响）→曝光层（规模化触达），明确各层目标和核心动作",
        "规划三层执行方案：品牌官方层/KOL层/UGC层，明确各层内容形式和资源分配",
        "设计备选方案以应对IP资源变动，整合IP排期到品牌全年传播日历"
      ],
      "output_types": [
        "IP合作规划框架",
        "全年Campaign日历"
      ],
      "failure_modes": [
        "IP合作策略忽视品牌调性匹配度——单纯追求IP热度可能稀释品牌资产"
      ],
      "boundaries": [
        "IP合作策略忽视品牌调性匹配度——单纯追求IP热度可能稀释品牌资产"
      ],
      "variants": [
        {
          "variant_id": "lens_e241763f47078776659b5ce2215cd25b",
          "name": "传播战役与消费者旅程：如何设计KOL分层辐射圈，按人群分层设计差异化的传播活动？...",
          "use_conditions": [
            "品牌需要进行该模块相关的策略分析",
            "有可获取的相关数据和消费者洞察"
          ],
          "analysis_operations": [
            "将目标人群按运动参与度分层（精英/运动健身/中轻度/非运动人群）",
            "为每层设计差异化的传播活动和话题（专业种草/趣味挑战/社交话题/病毒传播）",
            "设计品牌IP活动（如奇人三项）创造线上线下联动体验",
            "通过统一的品牌主题整合各层传播"
          ],
          "source_module_instance_ids": [
            "mi_e241763f47078776659b5ce2"
          ]
        }
      ],
      "source_module_instance_ids": [
        "mi_1a5bbbda8a3c00747cbd89bf",
        "mi_2ca1cbf1bdff13898b452d70",
        "mi_d441eaf936ac6884777b12ef"
      ]
    },
    {
      "lens_id": "lens_campaign-journey-002",
      "name": "消费者决策路径与传播链路设计",
      "aliases": [],
      "question": "如何基于消费者从认知到购买的完整决策路径，为每个阶段设计针对性的触达策略和跨阶段转化机制？",
      "use_conditions": [
        "需要基于消费者决策行为设计多触点的传播策略",
        "已有消费者的行为和决策路径数据（搜索数据、消费者调研、平台洞察等）"
      ],
      "skip_conditions": [
        "消费者决策路径极短（冲动购买或习惯性购买），不需要多阶段设计"
      ],
      "required_inputs": [
        "消费者画像与行为洞察",
        "消费者购买决策路径数据",
        "可用传播平台矩阵"
      ],
      "analysis_operations": [
        "识别消费者决策路径的关键阶段（触发注意→信息搜索→信任验证→购买决策→使用分享），标注每阶段的消费者行为特征",
        "按消费者细分类型，为不同阶段设计差异化的触达策略和沟通内容",
        "为每个阶段匹配最有效的触达渠道和内容形式",
        "设计跨阶段用户流转承接机制（搜索词→落地页、口碑内容→搜索验证回流、种草内容→购买链路）"
      ],
      "output_types": [
        "消费者旅程传播方案"
      ],
      "failure_modes": [
        "消费者旅程模型过于简化——实际决策路径可能非线性"
      ],
      "boundaries": [
        "消费者旅程模型过于简化——实际决策路径可能非线性"
      ],
      "variants": [],
      "source_module_instance_ids": [
        "mi_e3783891bec1c719cd26310f",
        "mi_e3e66feec6e1b9e8f98ce844"
      ]
    },
    {
      "lens_id": "lens_campaign-journey-003",
      "name": "分层社交内容框架（5W模型）",
      "aliases": [],
      "question": "如何围绕品牌理念建立从「品牌是什么」到「什么时候说」的五层社交内容框架，使品牌内容既有深度又有节奏？",
      "use_conditions": [
        "品牌有清晰的理念/定位，可以拆解为多层内容叙事",
        "需要在社交平台上持续产出有层次的内容"
      ],
      "skip_conditions": [
        "品牌只需要短期或单一类型的内容执行"
      ],
      "required_inputs": [
        "品牌理念与核心定位",
        "目标消费者细分画像",
        "年度业务目标与关键节点"
      ],
      "analysis_operations": [
        "WHAT层：将品牌核心理念转化为具体的内容主题，建立品牌认知基础",
        "WHY层：挖掘品牌理念与社会文化趋势的关联点，制造文化张力和话题性",
        "WHO层：围绕细分人群制作生活方式内容，建立「品牌懂我」的身份连接",
        "HOW层：展示品牌理念在具体场景中的呈现方式，让消费者看到可感知的价值",
        "WHEN层：将五层内容框架与季节性需求/营销节点匹配，形成全年社交内容日历"
      ],
      "output_types": [
        "5W社交内容框架",
        "全年内容日历"
      ],
      "failure_modes": [
        "5W框架层级之间缺乏连贯性——需确保从理念到执行的叙事递进"
      ],
      "boundaries": [
        "5W框架层级之间缺乏连贯性——需确保从理念到执行的叙事递进"
      ],
      "variants": [],
      "source_module_instance_ids": [
        "mi_1d6b33704028074c63c6a2f8"
      ]
    },
    {
      "lens_id": "lens_campaign-journey-004",
      "name": "年度节点主题化传播规划",
      "aliases": [],
      "question": "如何围绕品牌年度核心主题，按季节/节日节点设计分场景的产品组合和传播方案？",
      "use_conditions": [
        "品牌有年度核心传播主题，需要按季节/节点落地为具体传播方案",
        "产品线较为丰富，不同季节/节点可以有不同的产品组合"
      ],
      "skip_conditions": [
        "品牌只需单一节点的传播方案而非全年规划",
        "品牌年度主题尚未确定"
      ],
      "required_inputs": [
        "品牌年度核心主题",
        "产品线与适用场景",
        "季节/节日节点日历",
        "目标消费者场景需求洞察"
      ],
      "analysis_operations": [
        "将品牌年度核心主题拆解为可操作的子主题和关键信息",
        "按季节/节日节点识别消费者场景需求，匹配对应的产品组合",
        "针对每个节点提炼差异化的消费者痛点和产品卖点",
        "规划各节点的传播资源分配、时间节奏和预期效果",
        "确保各节点之间的主题连贯性和叙事递进"
      ],
      "output_types": [
        "年度节点传播规划",
        "分场景产品策略"
      ],
      "failure_modes": [
        "节点规划与消费者实际节奏错位"
      ],
      "boundaries": [
        "节点规划与消费者实际节奏错位"
      ],
      "variants": [],
      "source_module_instance_ids": [
        "mi_e3783891bec1c719cd26310f"
      ]
    }
  ],
  "recipes": [],
  "page_expression_options": [],
  "source_module_instance_ids": [
    "mi_1a5bbbda8a3c00747cbd89bf",
    "mi_1d6b33704028074c63c6a2f8",
    "mi_2ca1cbf1bdff13898b452d70",
    "mi_d441eaf936ac6884777b12ef",
    "mi_e3783891bec1c719cd26310f",
    "mi_e3e66feec6e1b9e8f98ce844",
    "mi_e241763f47078776659b5ce2"
  ],
  "wiki_version": "6.0.0",
  "status": "active",
  "approval": {
    "human_approved": true,
    "approved_at": "2026-07-27T12:18:11.789Z",
    "reviewer_note": "B4审阅：1项变更批准"
  },
  "deletion": {
    "deleted": false,
    "reason": "",
    "replaced_by": null
  },
  "created_from_hash": "18b6c931405793c8a354bf1f4eada7b294840e3c9e7d2f8746941ddd9b530df9"
}