{
  "contract_version": "1.0.0",
  "wiki_module_id": "wm_ff06a37c7fc526afb0e16ea9",
  "module_id": "mod_creator-kol",
  "title": "KOL/达人矩阵策略",
  "stable_decision": "模块「KOL/达人矩阵策略」共收录 2 个可复用方法，经跨案例验证和人工审阅。",
  "unified_preconditions": [
    "项目需包含与KOL/达人矩阵策略相关的分析材料",
    "分析单元需通过B2分段验证"
  ],
  "lens_catalog": [
    {
      "lens_id": "lens_creator-kol-001",
      "name": "KOL/达人矩阵分层与预算分配策略",
      "aliases": [],
      "question": "如何按平台特征和品牌目标设计差异化的达人矩阵金字塔，并合理分配预算和各层级达人的核心任务？",
      "use_conditions": [
        "品牌需要系统规划和分配KOL/达人合作资源",
        "品牌传播涉及多个层级的达人合作"
      ],
      "skip_conditions": [
        "品牌不需要达人合作或只需零星投放"
      ],
      "required_inputs": [
        "品牌传播目标（声量/种草/转化权重）",
        "平台达人资源与价格带",
        "项目预算总额"
      ],
      "analysis_operations": [
        "按功能角色对达人分类（内容深度型/体验展示型/氛围传播型等），定义各角色的筛选标准和预期贡献",
        "按平台特征设计差异化的达人金字塔结构：不同平台的内容生态和受众特征决定了最佳的层级配比",
        "按达人层级和平台维度分配预算，明确各层的预算占比和预期效果KPI",
        "为每层达人设定核心任务和内容原则（如真实感优先/场景化展示/专业深度等）"
      ],
      "output_types": [
        "达人矩阵方案",
        "预算分配表"
      ],
      "failure_modes": [
        "KOL筛选过度依赖粉丝量——互动率和粉丝画像匹配度更重要"
      ],
      "boundaries": [
        "KOL筛选过度依赖粉丝量——互动率和粉丝画像匹配度更重要"
      ],
      "variants": [
        {
          "variant_id": "lens_516f67b4ffa6284926cfa247203498fb",
          "name": "KOL/达人矩阵策略：如何围绕品牌社群活动体系设计KOL/KOC合作矩阵和用户分层运营方案？...",
          "use_conditions": [
            "品牌需要进行该模块相关的策略分析",
            "有可获取的相关数据和消费者洞察"
          ],
          "analysis_operations": [
            "按参与深度将用户分为不同层级（活动参与者/内容贡献者/社群组织者）",
            "为每层设计差异化的激励和成长机制",
            "设计与品牌活动关联的KOL/KOC合作模式（冠名/内容共创/路线设计）",
            "建立从线上内容消费到线下活动参与再到门店购买的转化闭环"
          ],
          "source_module_instance_ids": [
            "mi_516f67b4ffa6284926cfa247"
          ]
        }
      ],
      "source_module_instance_ids": [
        "mi_055a466d2c6cec7cc2c39382",
        "mi_20760274f4948a216c54a284"
      ]
    },
    {
      "lens_id": "lens_creator-kol-002",
      "name": "品牌倡导者涟漪分层与KOL生态构建",
      "aliases": [],
      "question": "如何构建从核心专业用户逐层传导至大众消费者的品牌倡导者体系，并建立可持续的KOL生态运营机制？",
      "use_conditions": [
        "品牌需要建立长期可持续的达人/KOL/KOC生态",
        "品牌有可识别的核心用户或倡导者群体"
      ],
      "skip_conditions": [
        "品牌只需要一次性的达人投放"
      ],
      "required_inputs": [
        "品牌核心用户群体特征分析",
        "领域内倡导者体系建设标杆品牌案例",
        "目标平台KOL生态数据"
      ],
      "analysis_operations": [
        "研究领域内标杆品牌的倡导者分层结构和传导机制，提取可借鉴的分层逻辑和角色定义",
        "结合品牌自身用户画像和社区特征，绘制品牌专属的倡导者涟漪传导结构",
        "定义各层级的招募标准、权益体系（物质激励/荣誉认可/成长机会/社区归属）、内容角色和激励机制",
        "设计长期生态运营机制：招募流程/日常管理/内容共创/效果评估/升降级规则/社区管理模式"
      ],
      "output_types": [
        "品牌倡导者分层框架",
        "KOL生态构建方案"
      ],
      "failure_modes": [
        "品牌倡导者体系需要长期投入——短期KPI导向可能破坏社区信任"
      ],
      "boundaries": [
        "品牌倡导者体系需要长期投入——短期KPI导向可能破坏社区信任"
      ],
      "variants": [],
      "source_module_instance_ids": [
        "mi_9f439469e8648005736dc183"
      ]
    }
  ],
  "recipes": [],
  "page_expression_options": [],
  "source_module_instance_ids": [
    "mi_055a466d2c6cec7cc2c39382",
    "mi_20760274f4948a216c54a284",
    "mi_9f439469e8648005736dc183",
    "mi_516f67b4ffa6284926cfa247"
  ],
  "wiki_version": "6.0.0",
  "status": "active",
  "approval": {
    "human_approved": true,
    "approved_at": "2026-07-27T12:18:11.789Z",
    "reviewer_note": "B4审阅：1项变更批准"
  },
  "deletion": {
    "deleted": false,
    "reason": "",
    "replaced_by": null
  },
  "created_from_hash": "a12631e12fdba52bede663c260adb9d9d796fc834987398cf48f6f285adbd9a3"
}