{
  "contract_version": "1.0.0",
  "wiki_module_id": "wm_cf932106ff63c30253c38992",
  "module_id": "mod_consumer-insight",
  "title": "消费者洞察",
  "stable_decision": "模块「消费者洞察」新增 1 个可复用方法，源自某童装品牌升级案例。",
  "unified_preconditions": [
    "项目需要消费者产品需求和使用体验的原始调研数据",
    "有竞品消费者认知对比数据可参照"
  ],
  "lens_catalog": [
    {
      "lens_id": "lens_mod_consumer-insight-5adf4bcb",
      "name": "用户真实需求 vs. 设计假设的差距分析法",
      "aliases": [],
      "question": "当产品设计基于品牌对消费者需求的假设而非消费者真实体验时，如何系统识别产品功能与用户痛点之间的差距，并指导产品优化方向？",
      "use_conditions": [
        "产品根据设计师或行业经验设计，未经过系统的消费者使用验证",
        "有消费者对现有产品的不满/投诉/替换行为的定性或定量数据",
        "需要从消费者视角重新定义产品优先级和迭代方向",
        "品类中存在'品牌认为好的设计'与'消费者实际需要的功能'之间的鸿沟"
      ],
      "skip_conditions": [
        "产品完全由消费者共创设计，需求验证充分",
        "品类高度技术驱动，消费者体验差异主要体现在性能参数",
        "缺乏消费者对现有产品的使用反馈数据"
      ],
      "required_inputs": [
        "现有产品的消费者使用反馈（评论/投诉/退换货原因）",
        "设计师/产品团队的设计假设陈述",
        "竞品产品功能和消费者评价对比数据",
        "消费者购买决策因素排序数据",
        "跨品类消费者通用需求演变趋势"
      ],
      "analysis_operations": [
        "设计假设梳理：收集产品团队/品牌方对消费者需求的理解和设计假设，整理为可验证的命题列表",
        "消费者反馈收集：按痛点的严重程度和频率，整理消费者对现有产品的真实不满和使用障碍",
        "鸿沟映射：将设计假设与消费者反馈逐一对比，标注'假设正确/假设错误/重要疏漏'三类关系，量化差距规模",
        "需求优先级重排：基于消费者反馈的严重性和频率，重新排列产品优化的优先级顺序",
        "产品优化方向推导：综合鸿沟分析和优先级排序，产出具体的产品改进方向和沟通重点建议"
      ],
      "output_types": [
        "设计假设与消费者需求对照矩阵",
        "产品优化优先级清单",
        "消费者真正关注的核心功能维度定义",
        "产品沟通重点调整建议"
      ],
      "failure_modes": [
        "消费者反馈样本量不足以代表目标人群",
        "未区分'少量用户的极端不满'和'大量用户的一般性需求'",
        "过度反应于小众反馈而偏离主流需求"
      ],
      "boundaries": [
        "核心适用场景是产品设计团队与消费者之间存在认知差距的品类",
        "反馈数据需要区分真实痛点和'说得好听但非实际决策因素'的偏差"
      ],
      "variants": [
        {
          "variant_id": "lens_d9e8e4bc53fc9490467228fd093ec6c2",
          "name": "消费者洞察：如何系统识别消费者真实需求与品牌设计假设之间的差距，通过消费者原话验证找到产品优...",
          "use_conditions": [
            "品牌需要进行该模块相关的策略分析",
            "有可获取的相关数据和消费者洞察"
          ],
          "analysis_operations": [
            "收集消费者对产品的定性反馈（访谈/评论/投诉）",
            "梳理品牌方对产品设计的设计假设",
            "建立设计假设与消费者真实体验的对照矩阵",
            "识别差距最大的维度作为优先优化方向",
            "将消费者原话转化为产品改进原则"
          ],
          "source_module_instance_ids": [
            "mi_d9e8e4bc53fc9490467228fd"
          ]
        }
      ],
      "source_module_instance_ids": [
        "mi_e16fadb83e4c87171ea03bf7"
      ],
      "evidence": "源自某童装品牌升级：通过对比'妈妈以为的好看设计'（阔腿裤/高领毛衣/紧身裤/小亮片）与'孩子的不适甚至危险'，识别出舒适面料/工艺/细节才是消费者真正在意的核心价值，从而重塑品牌定位为'看见孩子的舒适'",
      "abstraction_self_check": {
        "passed": true,
        "checks": {
          "brand_terms_remaining": false,
          "steps_not_actionable": false,
          "conditions_case_specific": false,
          "skip_data_driven": false,
          "steps_too_generic": false,
          "project_fill_value": false
        },
        "issues": [],
        "needs_human_review": false,
        "abstraction_difficulty": "medium"
      },
      "page_structure": [
        {
          "page": 1,
          "title": "设计假设厘清",
          "content": "梳理产品团队/品牌方对消费者需求的核心假设——他们认为消费者在意什么、产品设计的出发点是什么。每条假设标注来源（设计/产品/营销），目的是让隐性假设显性化"
        },
        {
          "page": 2,
          "title": "消费者真实反馈",
          "content": "整理消费者对产品的真实评价和不满。不论数据形式（评论/投诉/问卷/访谈），核心是呈现消费者实际在意的点与团队假设的差异。可以用痛点清单或分类框架组织"
        },
        {
          "page": 3,
          "title": "假设与现实差异分析",
          "content": "对比'我们以为消费者要的'与'消费者实际说的'，标注一致/冲突/遗漏三类关系。核心结论是：最大的认知差距在哪里、最严重的被忽视需求是什么"
        },
        {
          "page": 4,
          "title": "产品优化与沟通建议",
          "content": "基于差距分析输出产品优化方向建议（改进什么、优先级）和沟通策略建议（已有优势怎么讲、新功能怎么传播）。建议要区分短期可执行和中长期规划"
        }
      ]
    }
  ],
  "recipes": [],
  "page_expression_options": [],
  "source_module_instance_ids": [
    "mi_e16fadb83e4c87171ea03bf7",
    "mi_d9e8e4bc53fc9490467228fd"
  ],
  "wiki_version": "7.0.0",
  "status": "active",
  "approval": {
    "human_approved": true,
    "approved_at": "2026-07-27T12:18:11.789Z",
    "reviewer_note": "B4审阅：1项变更批准"
  },
  "deletion": {
    "deleted": false,
    "reason": "",
    "replaced_by": null
  },
  "created_from_hash": "d2078c48ab4b4ffe8307d20fd83aa15441c0ae5ce3abfb83eefedfdd59262a48"
}